id,customer_id,product_variant_id,product_id,rating,title,comment,created_at
"1","2","6","5","3","urbs coniecto bis aptus","Synagoga stips amet ara vulnus bonus templum.","2023-05-17 09:12:25"
"2","2","4","3","1","tabula dedico argumentum","Video decor thorax consectetur advenio molestiae textor amet. Umquam amissio denego calcar volubilis virga. Deprimo alo defendo titulus tantillus vinum desolo tracto.","2022-06-08 08:14:14"
"3","2","2","5","5","defluo clam excepturi creptio","Cuius decipio debeo laborum tergeo.","2017-01-16 22:12:35"
"4","6","8","5","4","casus doloremque aranea virgo","Tres conqueror tempore decimus abstergo cedo confero labore valde. Caecus vicinus eaque subvenio timor. Vallum alius hic.","2023-09-09 10:53:15"
"5","1","1","2","2","dolorem agnosco tamen coadunatio","Desidero amicitia communis vis error adeptio verecundia annus avaritia iusto.","2018-05-31 02:57:40"